BOK_FB01|CI0487,mens,Reebok Classic x Freebandz Tee
SAKS_0400090720616|8056040144183,womens,La Petite Robe di Chiara Boni Cascading Sleeveless Gown
AERIE_0024442956|0024442956,womens,Aerie Lace Hem Boxer
AERIE_0023610504|0023610470,unisex,Aerie Boybrief
HERBERGERS_1049074|0884453661199,womens,Three Seasons Maternity Lace Shoulder High Low Tank
EXPRS_7924109|74179381,womens,black strappy cami sundress
EDDIEBAUER_20612384|0060227479000040,womens,Women's Lodge Down Jacket
NYANDCO_07581962|76087523,womens,Eva Mendes Collection - Joelle Shirt Dress with Lace Shorts
HERBERGERS_608519|0769534425351,mens,Calvin Klein Men's Signature Slim Fit Twill Pant
NYANDCO_03801322|54071289,womens,Bandage Full Skirt
ELDERBEERMAN_1005567|0885779556183,womens,Hippie Laundry Acid Wash Bootcut Jeans
SAKS_0400088105358|0400881053612,mens,Timo Weiland Dante Woven Sweatpants
AERIE_0024208126|0024208126,womens,Aerie Boyfriend Tank
BDGM_prod105680091|sku87970477,mens,Berluti Polo with Leather Detail
AERIE_0024235640|0024235673,womens,Aerie Scoop Bikini Top
SAKS_0400090738346|0841692119157,mens,Sol Angeles Spray Wave Short Sleeve Tee
SAKS_0400000103921|0400000102009,mens,Comme des Garcons Play Zip-Up Hoodie
BDGM_prod124280013|sku98940126,womens,FRAME Le High Distressed Skinny Jeans
UARM_1281063|1281063-001-MD,mens,Men's UA Lounge Pants
EXPRS_9702868|97139492,womens,hi-lo military pocket shirt
PFRED_KMF301S|KMF301S|Small|Black,mens,
NEIMAN_prod190240067|sku164590165,womens,Bermuda Button-Front Blouse
BERGNERS_1107382|0884072425981,womens,Philosophy by Republic Clothing Printed Bell Sleeve Tunic
SAKS_0426442760577|0886992691606,mens,7 For All Mankind Cotton-Linen Chino Shorts
AERIE_0024592545|0024592545,womens,Aerie Real Soft Off-the-Shoulder Crop Tee
AEGL_prod6367131|0024989238,womens,AEO Sateen X4 Jegging
HERBERGERS_1084050|0666805037544,womens,
RALPH_99309766|24300423,mens,Ralph Lauren Rrl Indigo Cotton Sport Coat Indigo S
EBW_74420|74420-RETR-34DD,womens,Sunsets Swimwear Retreat Retreat Underwire Bandeau Tankini Top (D+ Cup) Size 34DD
SAKS_0400090606621|8032985944545,womens,Piazza Sempione Circle Jacquard Bolero Jacket
EXPRS_08091594|10214039,womens,EXP core yoga coffee brunch graphic v-neck tee
NEIMAN_prod192310136|sku165920555,womens,Stand-Collar Military Sweater Jacket
RALPH_107193436|24641040,mens,Ralph Lauren Rrl Calfskin Jacket Black S
LUCKY_7W42850|190365133342,womens,MIX FABRIC TANK
PFRED_KML176V|KML176V|3X Large|Brown,mens,Silk
EBW_71710|71710-BL-24W,womens,Miraclesuit Swimwear Miraclesuit Womens Black One Piece Swimdress (16W-24W) Size 20W Swimsuit
HERBERGERS_1109453|0884072426568,womens,Philosophy by Republic Clothing Lace-Up Blouse
AERIE_0023229214|0023229073,womens,Bridget Pushup Bra
AERIE_0023228794|0023228976,womens,Brooke Pushup Bra
NEIMAN_prod190480295|sku164751427,womens,Hanro Seraphina Long-Sleeve Wool-Silk Blend Top
EXPRS_8269495|96532799,womens,one shoulder pullover sweater
YOUNKERS_1132198|0734008603207,womens,
MOOSEJAW_10310796|3060939,mens,Moosejaw Circle of Life Heavy Weight Pullover Hoody - Mens
SAKS_0400089391095|0849454048004,womens,For Love & Lemons Gianna Lace Cropped Top
HERBERGERS_1068806|0884072269561,womens,
NEIMAN_prod190240142|sku164590518,womens,Sleeveless Silk Southwestern Top
LAT_0500046976213|46976239,womens,Alex Evenings Squareneck Sleeveless Dress
AEGL_prod6324005|0023396427,mens,"AEO Solid 9"" Flex Trunk"
BDGM_prod104390014|sku87230094,mens,TOM FORD Windowpane-Pattern Silk Dress Shirt
AEGL_4439_9734|0024988826,womens,AEO Denim X Super Low Jegging
SAKS_0400092024096|0190328909274,mens,Polo Ralph Lauren Nylon-Hooded Sweatshirt
HBOSS_hbna50322614450|4021418644354155,mens,Hugo Boss T-Christo Slim Fit
EDDIEBAUER_prod1510001|0036502014009278,mens,Men's Flex Jeans - Slim Straight Fit
AERIE_0024267734|0024267767,womens,Bridget Lace Pushup Bra
EXPRS_6341983|86275370,womens,express one eleven v-neck skimming tee
RALPH_110340116|24769093,womens,Ralph Lauren Lauren Quilted Jacquard-Knit Vest Blue Xs
NYANDCO_03784617|55781947,womens,7th Avenue Design Studio Pant - Signature - Universal Fit - Slim Ankle - Optic Twill
NEIMAN_prod190170051|sku164560192,womens,Alice + Olivia Angie 5-Pocket Leather Leggings
NEIMAN_prod192420155|sku165980527,womens,Lafayette 148 New York Makayla Cape-Sleeve Coat w/ Calf-Hair Panels
SAKS_0400090650158|8031382357484,womens,Plus Size Sport Colorblock Shift Dress
HERBERGERS_1045731|0801910654129,womens,
EDDIEBAUER_45126|0097165591000040,womens,Women's Legend Wash Sweatshirt - Colorblock
MOOSEJAW_10203884|1883996,mens,Kuhl Slackr Pant - Mens
ELDERBEERMAN_1021431|0773681145659,womens,
BERGNERS_1063470|0637348230716,womens,A. Byer Lace Tiered Skirt
EBW_71951|71951-TROA-T6,womens,Sunsets Swimwear Tropical Oasis Tropical Oasis Underwire Bra Tankini Top (E-H Cup) Size Tier 4
RALPH_80054526|22994559,mens,Polo Ralph Lauren Slim-Fit Pima Cotton Chino Boating Khaki 36Wx32l
BERGNERS_1092512|0704974050329,womens,
SAKS_0400090840373|0725840127624,womens,BOSS Dency Sheath Dress
ELDERBEERMAN_1078525|0085143696570,womens,
MOOSEJAW_10315546|3132970,womens,The North Face Sally Pant - Womens
NYANDCO_07727447|62366245,womens,Chiffon Off-The-Shoulder Dress
MOOSEJAW_10292131|3204971,womens,Kavu Ladies Legging - Womens
PFRED_KHL205L|KHL205L|Extra Large|Brown,mens,Italian Extra Fine Merino Wool Mock Neck Sweater
MOOSEJAW_10318943|3205782,mens,Craghoppers Nat Geo Pro Lite Softshell Trouser - Mens
NEIMAN_prod190260422|sku164602366,womens,3/4-Sleeve Illusion Sheer Cardigan
NEIMAN_prod190340083|sku164650502,womens,Bedhead Rose-Print Short Kimono Robe
SAKS_0400090589016|3612458030927,mens,Lanvin Two-Button Houndstooth Jacket
LAT_0500047826672|47826748,womens,Betsy & Adam Embroidered Floral Trumpet Gown
SAKS_0400090761992|7613355054555,mens,Belstaff Blackrod Slim-Fit Moto Jeans
NEIMAN_prod187480201|sku163392861,womens,St. John Collection Tie-Neck Slit-Sleeve Silk Blouse
EBW_71136|71136-COGV-34DD,womens,Swim Systems Swimwear Bikini Coconut Grove Coconut Grove Underwire Bra Top (D+ Cup) Size 32D
NEIMAN_prod193760615|sku166692822,womens,Eileen Fisher Merino Boxy Bateau-Neck Sweater
NYANDCO_06170884|22099031,womens,7th Avenue Design Studio - Modern Fit - Zip-Accent Mini Skirt - Optic Twill
EBW_74669|74669-IRIS-S,womens,B. Swim Swimwear Bikini Iris Iris Brazilian Bottom Size M
RALPH_99309566|24300333,mens,Ralph Lauren Rrl Cotton Shawl-Collar Sweater Black Melange S
RALPH_102437186|24451203,mens,Polo Ralph Lauren Varick Slim Straight Jean Elliot Stretch 28Wx30l
SAKS_0400090694603|0884926230204,womens,Equipment Kate Moss For Equipment Slim Star-Print Silk Blouse
AERIE_0024262404|0024262362,womens,Ella Gel Lace Pushup Bra
EDDIEBAUER_D0363088|0034175099000050,mens,Men's Independence Day Drawstring Shorts
RALPH_107496286|24650873,mens,Ralph Lauren Polo Sport Packable Down Vest Reflective Dot Camo M
ELDERBEERMAN_1027489|0758416413951,womens,Sangria Floral Sheath Dress
LAT_0500046351995|46352001,womens,Xscape Pleated Lace-Accented Gown
EXPRS_2055126|90320253,womens,black EXP core crew neck cut-out sports bra
SAKS_0400090798360|0884913519800,womens,Alo Yoga Altitude Puffer Vest
AERIE_0024435752|0024435729,womens,Aerie Real Soft Swing Tank
AEGL_4373_4714_140|0024746927,womens,AEO Soft & Sexy Jegging T-Shirt
SAKS_0400089720507|3610926685037,womens,
ELDERBEERMAN_396276|0788627292656,womens,Calvin Klein Performance Compression Pants
BERGNERS_1055761|0888252744930,womens,
